#   TIME      SOURCE         DESTINATION    PROTO  LENGTH  INFO
5   0.040000  192.168.1.100  93.184.216.34  TCP    60      50001 → 80 [SYN] Seq=0 Win=64240 Len=0
6   0.050000  93.184.216.34  192.168.1.100  TCP    60      80 → 50001 [SYN, ACK] Seq=0 Ack=1 Win=64240 Len=0
7   0.060000  192.168.1.100  93.184.216.34  TCP    60      50001 → 80 [ACK] Seq=1 Ack=1 Win=64240 Len=0
10  0.090000  192.168.1.100  93.184.216.34  TCP    60      50001 → 80 [ACK, FIN] Seq=70 Ack=78 Win=64240 Len=0
11  0.100000  192.168.1.100  93.184.216.34  TCP    60      50002 → 443 [SYN] Seq=0 Win=64240 Len=0
12  0.110000  93.184.216.34  192.168.1.100  TCP    60      443 → 50002 [SYN, ACK] Seq=0 Ack=1 Win=64240 Len=0
13  0.120000  192.168.1.100  93.184.216.34  TCP    60      50002 → 443 [ACK] Seq=1 Ack=1 Win=64240 Len=0
